{
 "artifacts": {
  "invocations": "invocations.jsonl"
 },
 "changed_variable": {
  "baseline": "STANDARD",
  "experiment": "ONEZONE_IA",
  "name": "s3_storage_class"
 },
 "classification": {
  "expected_vs_observed": {
   "cold->cold": 50,
   "restore->restore": 50,
   "warm->warm": 100
  },
  "method": "FIXTURE: synthetic",
  "mismatches": 0
 },
 "commits": {
  "baseline": "7147a308205e1e51f8403b321d5d57b367c158d7",
  "experiment": "7147a308205e1e51f8403b321d5d57b367c158d7",
  "repo_dirty_at_build": false
 },
 "conclusion": "FIXTURE. Null result: within run-to-run variance; download is bound by the per-environment network quota.",
 "conditions": {
  "arms": [
   "inst",
   "rep"
  ],
  "concurrency": 10,
  "request_ids": [
   "probe",
   "r1",
   "r2",
   "r3",
   "r4"
  ],
  "rounds": 5,
  "started": "2026-10-20T00:00:00Z",
  "warm_per_arm_per_round": 20,
  "weight_fetch": "HEAD + parallel 64 MiB ranged GETs (32 threads) into a memfd"
 },
 "correctness": {
  "bit_identical": 100,
  "choice_flips": 0,
  "compared": 100,
  "max_abs_delta": 0.0
 },
 "cost": {
  "billed_duration_s": 512.4,
  "s3_gb_transferred": 214.7,
  "s3_request_usd": 0.0012,
  "total_usd": 6.12
 },
 "deployment": {
  "architecture": "arm64",
  "az": "not exposed to the function; Lambda chooses per environment",
  "functions": {
   "inst": "lkai-p1-inst",
   "rep": "lkai-p1-rep"
  },
  "memory_mb": 10240,
  "region": "us-east-2",
  "runtime": "python3.12",
  "runtime_version_arn": null,
  "snapstart": {
   "ApplyOn": "PublishedVersions"
  }
 },
 "errors": {
  "count": 0,
  "rows": []
 },
 "experiment_id": "E2-onezone-ia",
 "fixture": true,
 "hypothesis": "FIXTURE. One Zone-IA storage class changes download time.",
 "model": {
  "format": "GGUF Q8_0",
  "gguf_bytes": 2147483648,
  "id": "StrandsAgents/strands-decider-2B-qwen3.5-v1-2610",
  "revision": "216d1ccb"
 },
 "phases": {
  "inst": {
   "cold": {
    "context_init": {
     "histogram": {
      "counts": [
       1,
       4,
       3,
       4,
       7,
       6,
       7,
       3,
       4,
       4,
       4,
       3
      ],
      "edges": [
       0.098733,
       0.102446,
       0.106158,
       0.109871,
       0.113584,
       0.117296,
       0.121009,
       0.124722,
       0.128435,
       0.132147,
       0.13586,
       0.139573,
       0.143285
      ]
     },
     "max": 0.143285,
     "mean": 0.121617,
     "min": 0.098733,
     "n": 50,
     "p50": 0.119657,
     "p90": 0.1371,
     "p99": 0.143285,
     "stdev": 0.011346,
     "unit": "s"
    },
    "first_request_inference": {
     "histogram": {
      "counts": [
       2,
       1,
       1,
       7,
       3,
       6,
       5,
       5,
       11,
       5,
       1,
       3
      ],
      "edges": [
       0.519471,
       0.534739,
       0.550006,
       0.565274,
       0.580541,
       0.595808,
       0.611076,
       0.626343,
       0.641611,
       0.656878,
       0.672146,
       0.687413,
       0.70268
      ]
     },
     "max": 0.70268,
     "mean": 0.621454,
     "min": 0.519471,
     "n": 50,
     "p50": 0.622846,
     "p90": 0.667027,
     "p99": 0.70268,
     "stdev": 0.043745,
     "unit": "s"
    },
    "first_request_total": {
     "histogram": {
      "counts": [
       3,
       1,
       4,
       11,
       6,
       4,
       5,
       8,
       2,
       4,
       1,
       1
      ],
      "edges": [
       27.356167,
       27.480055,
       27.603942,
       27.727829,
       27.851716,
       27.975604,
       28.099491,
       28.223378,
       28.347265,
       28.471153,
       28.59504,
       28.718927,
       28.842814
      ]
     },
     "max": 28.842814,
     "mean": 28.031398,
     "min": 27.356167,
     "n": 50,
     "p50": 27.961813,
     "p90": 28.490441,
     "p99": 28.842814,
     "stdev": 0.33572,
     "unit": "s"
    },
    "model_load_mmap": {
     "histogram": {
      "counts": [
       2,
       6,
       3,
       5,
       10,
       6,
       7,
       6,
       4,
       0,
       0,
       1
      ],
      "edges": [
       0.78706,
       0.809784,
       0.832508,
       0.855232,
       0.877955,
       0.900679,
       0.923403,
       0.946127,
       0.968851,
       0.991575,
       1.014299,
       1.037022,
       1.059746
      ]
     },
     "max": 1.059746,
     "mean": 0.900967,
     "min": 0.78706,
     "n": 50,
     "p50": 0.900034,
     "p90": 0.967918,
     "p99": 1.059746,
     "stdev": 0.055533,
     "unit": "s"
    },
    "n": 50,
    "report_init_duration": {
     "histogram": {
      "counts": [
       1,
       4,
       3,
       4,
       6,
       10,
       5,
       8,
       4,
       2,
       2,
       1
      ],
      "edges": [
       26.618973,
       26.736992,
       26.85501,
       26.973029,
       27.091047,
       27.209066,
       27.327084,
       27.445103,
       27.563122,
       27.68114,
       27.799159,
       27.917177,
       28.035196
      ]
     },
     "max": 28.035196,
     "mean": 27.303631,
     "min": 26.618973,
     "n": 50,
     "p50": 27.302922,
     "p90": 27.658478,
     "p99": 28.035196,
     "stdev": 0.310886,
     "unit": "s"
    },
    "report_max_memory_mb": {
     "histogram": {
      "counts": [
       2,
       2,
       4,
       9,
       9,
       2,
       6,
       4,
       8,
       1,
       1,
       2
      ],
      "edges": [
       4207.427934,
       4222.01037,
       4236.592806,
       4251.175241,
       4265.757677,
       4280.340113,
       4294.922548,
       4309.504984,
       4324.08742,
       4338.669855,
       4353.252291,
       4367.834727,
       4382.417162
      ]
     },
     "max": 4382.417162,
     "mean": 4288.143722,
     "min": 4207.427934,
     "n": 50,
     "p50": 4277.994773,
     "p90": 4334.429493,
     "p99": 4382.417162,
     "stdev": 40.265257,
     "unit": "MB"
    },
    "warmup_inference": {
     "histogram": {
      "counts": [
       5,
       8,
       2,
       1,
       7,
       9,
       6,
       6,
       3,
       2,
       0,
       1
      ],
      "edges": [
       0.529109,
       0.543398,
       0.557686,
       0.571975,
       0.586264,
       0.600552,
       0.614841,
       0.629129,
       0.643418,
       0.657707,
       0.671995,
       0.686284,
       0.700572
      ]
     },
     "max": 0.700572,
     "mean": 0.599001,
     "min": 0.529109,
     "n": 50,
     "p50": 0.604223,
     "p90": 0.643892,
     "p99": 0.700572,
     "stdev": 0.040509,
     "unit": "s"
    },
    "weight_download": {
     "histogram": {
      "counts": [
       1,
       1,
       0,
       3,
       8,
       5,
       11,
       10,
       4,
       2,
       1,
       4
      ],
      "edges": [
       19.548237,
       20.365449,
       21.182661,
       21.999874,
       22.817086,
       23.634298,
       24.45151,
       25.268722,
       26.085934,
       26.903146,
       27.720358,
       28.53757,
       29.354782
      ]
     },
     "max": 29.354782,
     "mean": 25.020286,
     "min": 19.548237,
     "n": 50,
     "p50": 24.986712,
     "p90": 27.659193,
     "p99": 29.354782,
     "stdev": 2.007832,
     "unit": "s"
    }
   },
   "restore": {
    "first_request_inference": {
     "histogram": {
      "counts": [
       1,
       3,
       1,
       2,
       4,
       5,
       7,
       7,
       9,
       7,
       2,
       2
      ],
      "edges": [
       0.624933,
       0.656817,
       0.688702,
       0.720586,
       0.752471,
       0.784355,
       0.816239,
       0.848124,
       0.880008,
       0.911893,
       0.943777,
       0.975662,
       1.007546
      ]
     },
     "max": 1.007546,
     "mean": 0.846451,
     "min": 0.624933,
     "n": 50,
     "p50": 0.855867,
     "p90": 0.929423,
     "p99": 1.007546,
     "stdev": 0.085556,
     "unit": "s"
    },
    "first_request_total": {
     "histogram": {
      "counts": [
       1,
       3,
       6,
       5,
       9,
       4,
       9,
       6,
       5,
       0,
       1,
       1
      ],
      "edges": [
       4.010712,
       4.162607,
       4.314502,
       4.466397,
       4.618291,
       4.770186,
       4.922081,
       5.073976,
       5.225871,
       5.377766,
       5.529661,
       5.681556,
       5.833451
      ]
     },
     "max": 5.833451,
     "mean": 4.823071,
     "min": 4.010712,
     "n": 50,
     "p50": 4.784323,
     "p90": 5.244139,
     "p99": 5.833451,
     "stdev": 0.37572,
     "unit": "s"
    },
    "n": 50,
    "report_restore_duration": {
     "histogram": {
      "counts": [
       3,
       2,
       5,
       4,
       7,
       1,
       4,
       8,
       6,
       8,
       0,
       2
      ],
      "edges": [
       3.159514,
       3.290532,
       3.42155,
       3.552568,
       3.683587,
       3.814605,
       3.945623,
       4.076641,
       4.20766,
       4.338678,
       4.469696,
       4.600715,
       4.731733
      ]
     },
     "max": 4.731733,
     "mean": 3.97003,
     "min": 3.159514,
     "n": 50,
     "p50": 4.061777,
     "p90": 4.41763,
     "p99": 4.731733,
     "stdev": 0.400487,
     "unit": "s"
    },
    "restore_to_invoke": null,
    "snapshot_init": {
     "model_load_mmap": {
      "histogram": {
       "counts": [
        1,
        1,
        0,
        0,
        0,
        0,
        0,
        1,
        2,
        2,
        0,
        3
       ],
       "edges": [
        0.84873,
        0.856468,
        0.864206,
        0.871945,
        0.879683,
        0.887421,
        0.89516,
        0.902898,
        0.910636,
        0.918374,
        0.926113,
        0.933851,
        0.941589
       ]
      },
      "max": 0.941589,
      "mean": 0.910359,
      "min": 0.84873,
      "n": 10,
      "p50": 0.917165,
      "p90": 0.938832,
      "p99": 0.941589,
      "stdev": 0.032229,
      "unit": "s"
     },
     "weight_download": {
      "histogram": {
       "counts": [
        1,
        1,
        0,
        0,
        1,
        1,
        2,